{
  "apiVersion": "registry.rapid7.com/v1",
  "kind": "VendorMapping",
  "metadata": { "mapping_version": "v1.0.0" },
  "spec": {
    "vendors": [
      {
        "id": "microsoft",
        "name": "Microsoft",
        "services": [
          { "id": "microsoft-sentinel", "name": "Microsoft Sentinel", "category": "siem", "data_sources": [] }
        ]
      }
    ]
  }
}
